{
  "schema_version": "research-signal-common/0.1",
  "manifests": [
    {
      "manifest_id": "qm-openalex-mines-2024eoy-v1",
      "source": "OpenAlex",
      "observed_at": "2024-12-31T23:59:59Z",
      "universe_id": "institution:I70768539:lineage",
      "query_fingerprint": "sha256:dummy-openalex-query-v1",
      "parameters": {
        "institution_filter": "authorships.institutions.lineage:I70768539",
        "corpus": "core",
        "has_abstract_filter": false,
        "types_profile": "published_core/0.1"
      }
    },
    {
      "manifest_id": "qm-openalex-mines-2025h1-v1",
      "source": "OpenAlex",
      "observed_at": "2025-06-30T23:59:59Z",
      "universe_id": "institution:I70768539:lineage",
      "query_fingerprint": "sha256:dummy-openalex-query-v1",
      "parameters": {
        "institution_filter": "authorships.institutions.lineage:I70768539",
        "corpus": "core",
        "has_abstract_filter": false,
        "types_profile": "published_core/0.1"
      }
    }
  ],
  "observations": [
    {
      "observation_id": "obs-W1001-2025-06-30",
      "work_id": "W1001",
      "observed_at": "2025-06-30T23:59:59Z",
      "publication_date": "2025-05-12",
      "work_type": "article",
      "title": "Fast ion transport in a model solid electrolyte",
      "doi": "https://doi.org/10.0000/dummy.1001",
      "primary_topic": {
        "id": "T100",
        "label": "Solid-state battery materials"
      },
      "authorships": [
        {
          "author_id": "A1001",
          "author_label": "Alice Martin",
          "position": "first",
          "institutions": [
            {
              "id": "I70768539",
              "ror": "https://ror.org/04y8cs423",
              "label": "Mines Paris–PSL"
            }
          ]
        }
      ],
      "citation_snapshot": {
        "cited_by_count": 2,
        "provider": "OpenAlex"
      },
      "referenced_work_ids": ["W9001"],
      "inclusion": {
        "universe_id": "institution:I70768539:lineage",
        "reason": "authorship institution belongs to archived lineage",
        "matched_entity_ids": ["I70768539"]
      },
      "source": {
        "provider": "OpenAlex",
        "record_id": "W1001",
        "manifest_id": "qm-openalex-mines-2025h1-v1"
      }
    },
    {
      "observation_id": "obs-W1002-2025-06-30",
      "work_id": "W1002",
      "observed_at": "2025-06-30T23:59:59Z",
      "publication_date": "2025-02-08",
      "work_type": "conference-paper",
      "title": "Interface stability in composite solid electrolytes",
      "doi": null,
      "primary_topic": {
        "id": "T100",
        "label": "Solid-state battery materials"
      },
      "authorships": [
        {
          "author_id": "A1003",
          "author_label": "Chloé Durand",
          "position": "first",
          "institutions": [
            {
              "id": "I70768539",
              "ror": "https://ror.org/04y8cs423",
              "label": "Mines Paris–PSL"
            }
          ]
        }
      ],
      "citation_snapshot": {
        "cited_by_count": 1,
        "provider": "OpenAlex"
      },
      "referenced_work_ids": [],
      "inclusion": {
        "universe_id": "institution:I70768539:lineage",
        "reason": "authorship institution belongs to archived lineage",
        "matched_entity_ids": ["I70768539"]
      },
      "source": {
        "provider": "OpenAlex",
        "record_id": "W1002",
        "manifest_id": "qm-openalex-mines-2025h1-v1"
      }
    },
    {
      "observation_id": "obs-W2001-2024-12-31",
      "work_id": "W2001",
      "observed_at": "2024-12-31T23:59:59Z",
      "publication_date": "2024-01-20",
      "work_type": "article",
      "title": "A reusable method with unexpectedly broad uptake",
      "doi": "https://doi.org/10.0000/dummy.2001",
      "primary_topic": {
        "id": "T200",
        "label": "Scientific machine learning"
      },
      "authorships": [
        {
          "author_id": "A2001",
          "author_label": "Daniel Petit",
          "position": "first",
          "institutions": [
            {
              "id": "I70768539",
              "ror": "https://ror.org/04y8cs423",
              "label": "Mines Paris–PSL"
            }
          ]
        }
      ],
      "citation_snapshot": {
        "cited_by_count": 4,
        "provider": "OpenAlex"
      },
      "referenced_work_ids": ["W9100", "W9101"],
      "inclusion": {
        "universe_id": "institution:I70768539:lineage",
        "reason": "authorship institution belongs to archived lineage",
        "matched_entity_ids": ["I70768539"]
      },
      "source": {
        "provider": "OpenAlex",
        "record_id": "W2001",
        "manifest_id": "qm-openalex-mines-2024eoy-v1"
      }
    },
    {
      "observation_id": "obs-W2001-2025-06-30",
      "work_id": "W2001",
      "observed_at": "2025-06-30T23:59:59Z",
      "publication_date": "2024-01-20",
      "work_type": "article",
      "title": "A reusable method with unexpectedly broad uptake",
      "doi": "https://doi.org/10.0000/dummy.2001",
      "primary_topic": {
        "id": "T200",
        "label": "Scientific machine learning"
      },
      "authorships": [
        {
          "author_id": "A2001",
          "author_label": "Daniel Petit",
          "position": "first",
          "institutions": [
            {
              "id": "I70768539",
              "ror": "https://ror.org/04y8cs423",
              "label": "Mines Paris–PSL"
            }
          ]
        }
      ],
      "citation_snapshot": {
        "cited_by_count": 21,
        "provider": "OpenAlex"
      },
      "referenced_work_ids": ["W9100", "W9101"],
      "inclusion": {
        "universe_id": "institution:I70768539:lineage",
        "reason": "authorship institution belongs to archived lineage",
        "matched_entity_ids": ["I70768539"]
      },
      "source": {
        "provider": "OpenAlex",
        "record_id": "W2001",
        "manifest_id": "qm-openalex-mines-2025h1-v1"
      }
    },
    {
      "observation_id": "obs-W3001-2025-06-30",
      "work_id": "W3001",
      "observed_at": "2025-06-30T23:59:59Z",
      "publication_date": "2025-04-03",
      "work_type": "article",
      "title": "First joint study across two previously separate groups",
      "doi": "https://doi.org/10.0000/dummy.3001",
      "primary_topic": {
        "id": "T300",
        "label": "Environmental systems modelling"
      },
      "authorships": [
        {
          "author_id": "A3001",
          "author_label": "Eva Bernard",
          "position": "first",
          "institutions": [
            {
              "id": "I70768539",
              "ror": "https://ror.org/04y8cs423",
              "label": "Mines Paris–PSL"
            }
          ]
        },
        {
          "author_id": "A3002",
          "author_label": "Farid Laurent",
          "position": "last",
          "institutions": [
            {
              "id": "I3002",
              "ror": null,
              "label": "Dummy Partner Institute"
            }
          ]
        }
      ],
      "citation_snapshot": {
        "cited_by_count": 0,
        "provider": "OpenAlex"
      },
      "referenced_work_ids": [],
      "inclusion": {
        "universe_id": "institution:I70768539:lineage",
        "reason": "first author belongs to archived lineage",
        "matched_entity_ids": ["I70768539"]
      },
      "source": {
        "provider": "OpenAlex",
        "record_id": "W3001",
        "manifest_id": "qm-openalex-mines-2025h1-v1"
      }
    }
  ],
  "signals": [
    {
      "schema_version": "signal-envelope/0.1",
      "signal_id": "sig-topic-T100-2025h1",
      "detected_at": "2025-06-30T23:59:59Z",
      "detector": {
        "type": "topic_momentum",
        "version": "topic-momentum/0.1"
      },
      "universe": {
        "universe_id": "institution:I70768539:lineage",
        "kind": "institution",
        "label": "Mines Paris–PSL lineage",
        "scope_mode": "lineage",
        "entity_ids": ["I70768539"]
      },
      "subject": {
        "kind": "topic",
        "id": "T100",
        "label": "Solid-state battery materials",
        "member_ids": []
      },
      "analysis_context": {
        "current_window": {
          "start": "2024-07-01",
          "end": "2025-06-30"
        },
        "reference": {
          "kind": "historical_window",
          "reference_id": "previous-12-months",
          "window": {
            "start": "2023-07-01",
            "end": "2024-06-30"
          }
        }
      },
      "priority": {
        "score": 0.78,
        "method": "topic-momentum-priority/0.1",
        "components": {
          "volume_change": 0.8,
          "portfolio_share_change": 0.74,
          "historical_anomaly": 0.81
        }
      },
      "confidence": {
        "level": "MEDIUM",
        "score": 0.72,
        "factors": ["topic coverage above threshold", "two supporting works shown"],
        "limitations": ["dummy corpus", "provisional thresholds"]
      },
      "summary": {
        "headline": "Solid-state battery materials gains momentum",
        "why_unusual": "Volume and portfolio share rise together above the historical baseline."
      },
      "evidence": [
        {
          "evidence_id": "ev-topic-1",
          "type": "observation",
          "role": "supporting_work",
          "observed_at": "2025-06-30T23:59:59Z",
          "locator": {
            "kind": "observation",
            "id": "obs-W1001-2025-06-30"
          },
          "supports": "A recent work is assigned to the signalled topic."
        },
        {
          "evidence_id": "ev-topic-2",
          "type": "observation",
          "role": "supporting_work",
          "observed_at": "2025-06-30T23:59:59Z",
          "locator": {
            "kind": "observation",
            "id": "obs-W1002-2025-06-30"
          },
          "supports": "A second work shows activity across document types."